{
  "title": "Diabetes Plate Method",
  "shortSummary": "TODO: Write 200-300 character description about Diabetes Plate Method.",
  "whoItsFor": [
    "TODO: Target audience 1",
    "TODO: Target audience 2",
    "TODO: Target audience 3",
    "TODO: Target audience 4",
    "TODO: Target audience 5"
  ],
  "cautions": [
    {
      "group": "TODO: Caution group 1",
      "warning": "TODO: Warning text 1"
    },
    {
      "group": "TODO: Caution group 2",
      "warning": "TODO: Warning text 2"
    },
    {
      "group": "TODO: Caution group 3",
      "warning": "TODO: Warning text 3"
    }
  ],
  "goals": [
    "diabetes_management",
    "glycemic_control",
    "weight_loss"
  ],
  "corePrinciples": [
    "TODO: Core principle 1",
    "TODO: Core principle 2",
    "TODO: Core principle 3",
    "TODO: Core principle 4",
    "TODO: Core principle 5",
    "TODO: Core principle 6",
    "TODO: Core principle 7"
  ],
  "dailyTargets": [
    {
      "item": "Vegetables",
      "target": "TODO",
      "note": "TODO"
    },
    {
      "item": "Fruit",
      "target": "TODO",
      "note": "TODO"
    },
    {
      "item": "Protein",
      "target": "TODO",
      "note": "TODO"
    },
    {
      "item": "Grains",
      "target": "TODO",
      "note": "TODO"
    },
    {
      "item": "Water",
      "target": "TODO",
      "note": "TODO"
    }
  ],
  "weeklyTargets": [
    {
      "item": "Weekly target 1",
      "target": "TODO",
      "note": "TODO"
    },
    {
      "item": "Weekly target 2",
      "target": "TODO",
      "note": "TODO"
    },
    {
      "item": "Weekly target 3",
      "target": "TODO",
      "note": "TODO"
    },
    {
      "item": "Weekly target 4",
      "target": "TODO",
      "note": "TODO"
    }
  ],
  "foodsToFocus": [
    {
      "category": "Category 1",
      "examples": [
        "TODO",
        "TODO",
        "TODO"
      ]
    },
    {
      "category": "Category 2",
      "examples": [
        "TODO",
        "TODO",
        "TODO"
      ]
    },
    {
      "category": "Category 3",
      "examples": [
        "TODO",
        "TODO",
        "TODO"
      ]
    },
    {
      "category": "Category 4",
      "examples": [
        "TODO",
        "TODO",
        "TODO"
      ]
    },
    {
      "category": "Category 5",
      "examples": [
        "TODO",
        "TODO",
        "TODO"
      ]
    }
  ],
  "foodsToLimit": [
    {
      "category": "Limit category 1",
      "examples": [
        "TODO",
        "TODO",
        "TODO"
      ]
    },
    {
      "category": "Limit category 2",
      "examples": [
        "TODO",
        "TODO",
        "TODO"
      ]
    },
    {
      "category": "Limit category 3",
      "examples": [
        "TODO",
        "TODO",
        "TODO"
      ]
    },
    {
      "category": "Limit category 4",
      "examples": [
        "TODO",
        "TODO",
        "TODO"
      ]
    }
  ],
  "portionGuide": [
    {
      "item": "TODO",
      "portion": "TODO",
      "note": "TODO"
    },
    {
      "item": "TODO",
      "portion": "TODO",
      "note": "TODO"
    },
    {
      "item": "TODO",
      "portion": "TODO",
      "note": "TODO"
    },
    {
      "item": "TODO",
      "portion": "TODO",
      "note": "TODO"
    },
    {
      "item": "TODO",
      "portion": "TODO",
      "note": "TODO"
    }
  ],
  "sampleDayMenu": {
    "breakfast": {
      "name": "TODO: Breakfast",
      "description": "TODO: Breakfast description"
    },
    "lunch": {
      "name": "TODO: Lunch",
      "description": "TODO: Lunch description"
    },
    "dinner": {
      "name": "TODO: Dinner",
      "description": "TODO: Dinner description"
    },
    "snacks": [
      {
        "name": "TODO: Snack 1",
        "description": "TODO: Snack description"
      },
      {
        "name": "TODO: Snack 2",
        "description": "TODO: Snack description"
      }
    ]
  },
  "shoppingList": [
    {
      "category": "Produce",
      "items": [
        "TODO",
        "TODO",
        "TODO",
        "TODO"
      ]
    },
    {
      "category": "Protein",
      "items": [
        "TODO",
        "TODO",
        "TODO"
      ]
    },
    {
      "category": "Grains-Legumes",
      "items": [
        "TODO",
        "TODO",
        "TODO"
      ]
    },
    {
      "category": "Fats-Seasonings",
      "items": [
        "TODO",
        "TODO",
        "TODO"
      ]
    }
  ],
  "tips": [
    "TODO: Tip 1",
    "TODO: Tip 2",
    "TODO: Tip 3",
    "TODO: Tip 4",
    "TODO: Tip 5"
  ],
  "commonMistakes": [
    "TODO: Common mistake 1",
    "TODO: Common mistake 2",
    "TODO: Common mistake 3",
    "TODO: Common mistake 4"
  ],
  "faq": [
    {
      "question": "TODO: Question 1?",
      "answer": "TODO: Answer 1"
    },
    {
      "question": "TODO: Question 2?",
      "answer": "TODO: Answer 2"
    },
    {
      "question": "TODO: Question 3?",
      "answer": "TODO: Answer 3"
    },
    {
      "question": "TODO: Question 4?",
      "answer": "TODO: Answer 4"
    },
    {
      "question": "TODO: Question 5?",
      "answer": "TODO: Answer 5"
    }
  ],
  "references": [
    {
      "title": "TODO: Reference 1",
      "url": "TODO: https://example.com",
      "note": "TODO: Reference note"
    },
    {
      "title": "TODO: Reference 2",
      "url": "TODO: https://example.com",
      "note": "TODO: Reference note"
    },
    {
      "title": "TODO: Reference 3",
      "url": "TODO: https://example.com",
      "note": "TODO: Reference note"
    }
  ]
}