{
  "title": "MIND Diyeti",
  "shortSummary": "TODO: MIND Diyeti hakkında 200-300 karakter açıklama yazılacak.",
  "whoItsFor": [
    "TODO: Hedef kitle 1",
    "TODO: Hedef kitle 2",
    "TODO: Hedef kitle 3",
    "TODO: Hedef kitle 4",
    "TODO: Hedef kitle 5"
  ],
  "cautions": [
    {
      "group": "TODO: Dikkat edilmesi gereken grup 1",
      "warning": "TODO: Uyarı metni 1"
    },
    {
      "group": "TODO: Dikkat edilmesi gereken grup 2",
      "warning": "TODO: Uyarı metni 2"
    },
    {
      "group": "TODO: Dikkat edilmesi gereken grup 3",
      "warning": "TODO: Uyarı metni 3"
    }
  ],
  "goals": [
    "brain_health",
    "longevity",
    "heart_health"
  ],
  "corePrinciples": [
    "TODO: Temel prensip 1",
    "TODO: Temel prensip 2",
    "TODO: Temel prensip 3",
    "TODO: Temel prensip 4",
    "TODO: Temel prensip 5",
    "TODO: Temel prensip 6",
    "TODO: Temel prensip 7"
  ],
  "dailyTargets": [
    {
      "item": "Sebze",
      "target": "TODO",
      "note": "TODO"
    },
    {
      "item": "Meyve",
      "target": "TODO",
      "note": "TODO"
    },
    {
      "item": "Protein",
      "target": "TODO",
      "note": "TODO"
    },
    {
      "item": "Tahıl",
      "target": "TODO",
      "note": "TODO"
    },
    {
      "item": "Su",
      "target": "TODO",
      "note": "TODO"
    }
  ],
  "weeklyTargets": [
    {
      "item": "Haftalık hedef 1",
      "target": "TODO",
      "note": "TODO"
    },
    {
      "item": "Haftalık hedef 2",
      "target": "TODO",
      "note": "TODO"
    },
    {
      "item": "Haftalık hedef 3",
      "target": "TODO",
      "note": "TODO"
    },
    {
      "item": "Haftalık hedef 4",
      "target": "TODO",
      "note": "TODO"
    }
  ],
  "foodsToFocus": [
    {
      "category": "Kategori 1",
      "examples": [
        "TODO",
        "TODO",
        "TODO"
      ]
    },
    {
      "category": "Kategori 2",
      "examples": [
        "TODO",
        "TODO",
        "TODO"
      ]
    },
    {
      "category": "Kategori 3",
      "examples": [
        "TODO",
        "TODO",
        "TODO"
      ]
    },
    {
      "category": "Kategori 4",
      "examples": [
        "TODO",
        "TODO",
        "TODO"
      ]
    },
    {
      "category": "Kategori 5",
      "examples": [
        "TODO",
        "TODO",
        "TODO"
      ]
    }
  ],
  "foodsToLimit": [
    {
      "category": "Sınırlanacak kategori 1",
      "examples": [
        "TODO",
        "TODO",
        "TODO"
      ]
    },
    {
      "category": "Sınırlanacak kategori 2",
      "examples": [
        "TODO",
        "TODO",
        "TODO"
      ]
    },
    {
      "category": "Sınırlanacak kategori 3",
      "examples": [
        "TODO",
        "TODO",
        "TODO"
      ]
    },
    {
      "category": "Sınırlanacak kategori 4",
      "examples": [
        "TODO",
        "TODO",
        "TODO"
      ]
    }
  ],
  "portionGuide": [
    {
      "item": "TODO",
      "portion": "TODO",
      "note": "TODO"
    },
    {
      "item": "TODO",
      "portion": "TODO",
      "note": "TODO"
    },
    {
      "item": "TODO",
      "portion": "TODO",
      "note": "TODO"
    },
    {
      "item": "TODO",
      "portion": "TODO",
      "note": "TODO"
    },
    {
      "item": "TODO",
      "portion": "TODO",
      "note": "TODO"
    }
  ],
  "sampleDayMenu": {
    "breakfast": {
      "name": "TODO: Kahvaltı",
      "description": "TODO: Kahvaltı açıklaması"
    },
    "lunch": {
      "name": "TODO: Öğle yemeği",
      "description": "TODO: Öğle yemeği açıklaması"
    },
    "dinner": {
      "name": "TODO: Akşam yemeği",
      "description": "TODO: Akşam yemeği açıklaması"
    },
    "snacks": [
      {
        "name": "TODO: Ara öğün 1",
        "description": "TODO: Ara öğün açıklaması"
      },
      {
        "name": "TODO: Ara öğün 2",
        "description": "TODO: Ara öğün açıklaması"
      }
    ]
  },
  "shoppingList": [
    {
      "category": "Sebze-Meyve",
      "items": [
        "TODO",
        "TODO",
        "TODO",
        "TODO"
      ]
    },
    {
      "category": "Protein",
      "items": [
        "TODO",
        "TODO",
        "TODO"
      ]
    },
    {
      "category": "Tahıl-Baklagil",
      "items": [
        "TODO",
        "TODO",
        "TODO"
      ]
    },
    {
      "category": "Yağ-Baharat",
      "items": [
        "TODO",
        "TODO",
        "TODO"
      ]
    }
  ],
  "tips": [
    "TODO: İpucu 1",
    "TODO: İpucu 2",
    "TODO: İpucu 3",
    "TODO: İpucu 4",
    "TODO: İpucu 5"
  ],
  "commonMistakes": [
    "TODO: Yaygın hata 1",
    "TODO: Yaygın hata 2",
    "TODO: Yaygın hata 3",
    "TODO: Yaygın hata 4"
  ],
  "faq": [
    {
      "question": "TODO: Soru 1?",
      "answer": "TODO: Cevap 1"
    },
    {
      "question": "TODO: Soru 2?",
      "answer": "TODO: Cevap 2"
    },
    {
      "question": "TODO: Soru 3?",
      "answer": "TODO: Cevap 3"
    },
    {
      "question": "TODO: Soru 4?",
      "answer": "TODO: Cevap 4"
    },
    {
      "question": "TODO: Soru 5?",
      "answer": "TODO: Cevap 5"
    }
  ],
  "references": [
    {
      "title": "TODO: Reference 1",
      "url": "TODO: https://example.com",
      "note": "TODO: Kaynak notu"
    },
    {
      "title": "TODO: Reference 2",
      "url": "TODO: https://example.com",
      "note": "TODO: Kaynak notu"
    },
    {
      "title": "TODO: Reference 3",
      "url": "TODO: https://example.com",
      "note": "TODO: Kaynak notu"
    }
  ]
}